{
  "schemaVersion": "1.0",
  "id": "loop-expert-catalog-expert-1",
  "seed": "catalog-expert-1",
  "generatorVersion": "pipeline-1.0.0",
  "width": 10,
  "height": 10,
  "difficulty": "expert",
  "clues": [
    [
      0,
      0,
      1,
      3,
      1,
      2,
      2,
      3,
      1,
      0
    ],
    [
      0,
      0,
      0,
      2,
      2,
      3,
      2,
      1,
      0,
      0
    ],
    [
      0,
      0,
      1,
      2,
      1,
      1,
      2,
      1,
      0,
      0
    ],
    [
      1,
      2,
      2,
      1,
      1,
      1,
      2,
      1,
      0,
      0
    ],
    [
      2,
      1,
      1,
      1,
      3,
      2,
      2,
      0,
      0,
      0
    ],
    [
      1,
      1,
      3,
      1,
      1,
      2,
      2,
      2,
      1,
      0
    ],
    [
      1,
      1,
      2,
      2,
      1,
      3,
      2,
      2,
      2,
      1
    ],
    [
      2,
      1,
      1,
      3,
      2,
      2,
      1,
      3,
      2,
      1
    ],
    [
      2,
      2,
      2,
      3,
      1,
      3,
      2,
      3,
      1,
      1
    ],
    [
      1,
      3,
      1,
      1,
      1,
      1,
      0,
      2,
      3,
      1
    ]
  ],
  "solutionEdges": [
    "v:5:0",
    "v:6:0",
    "v:7:0",
    "h:8:0",
    "v:8:1",
    "v:9:1",
    "h:10:1",
    "v:9:2",
    "v:8:2",
    "v:7:2",
    "v:6:2",
    "v:5:2",
    "h:5:2",
    "v:5:3",
    "v:6:3",
    "h:7:3",
    "v:7:4",
    "h:8:3",
    "v:8:3",
    "h:9:3",
    "h:9:4",
    "h:9:5",
    "v:8:6",
    "h:8:5",
    "v:7:5",
    "v:6:5",
    "h:6:5",
    "v:6:6",
    "h:7:6",
    "h:7:7",
    "v:7:8",
    "h:8:7",
    "v:8:7",
    "h:9:7",
    "v:9:8",
    "h:10:8",
    "v:9:9",
    "v:8:9",
    "v:7:9",
    "v:6:9",
    "h:6:8",
    "h:6:7",
    "v:5:7",
    "h:5:6",
    "h:5:5",
    "h:5:4",
    "v:4:4",
    "h:4:4",
    "h:4:5",
    "h:4:6",
    "v:3:7",
    "v:2:7",
    "h:2:6",
    "h:2:5",
    "v:1:5",
    "h:1:5",
    "h:1:6",
    "h:1:7",
    "v:0:8",
    "h:0:7",
    "h:0:6",
    "h:0:5",
    "h:0:4",
    "h:0:3",
    "v:0:3",
    "h:1:3",
    "v:1:4",
    "v:2:4",
    "h:3:3",
    "h:3:2",
    "v:3:2",
    "h:4:1",
    "h:4:0",
    "v:4:0"
  ],
  "startingEdges": [
    "h:4:5",
    "h:9:4",
    "v:6:2",
    "v:7:2",
    "v:8:9"
  ],
  "metadata": {
    "loopLength": 74,
    "complexityScore": 1,
    "difficultyScore": 0.75,
    "turnCount": 42,
    "regionalCoverage": 8,
    "startingEdgeRatio": 0.06756756756756757,
    "boundingBoxWidthRatio": 1,
    "boundingBoxHeightRatio": 1,
    "rowsUsed": 11,
    "columnsUsed": 10,
    "estimatedSolveTimeSeconds": 592
  }
}
