{
  "schemaVersion": "1.0",
  "id": "loop-hard-daily-2026-10-10-hard",
  "seed": "daily-2026-10-10-hard",
  "generatorVersion": "pipeline-1.0.0",
  "width": 8,
  "height": 8,
  "difficulty": "hard",
  "clues": [
    [
      0,
      1,
      1,
      3,
      2,
      1,
      1,
      3
    ],
    [
      2,
      3,
      1,
      2,
      2,
      2,
      1,
      2
    ],
    [
      3,
      1,
      2,
      3,
      1,
      3,
      2,
      1
    ],
    [
      3,
      2,
      3,
      2,
      3,
      2,
      1,
      2
    ],
    [
      3,
      1,
      1,
      1,
      2,
      0,
      0,
      2
    ],
    [
      1,
      2,
      3,
      2,
      3,
      1,
      0,
      1
    ],
    [
      0,
      0,
      1,
      1,
      2,
      1,
      1,
      2
    ],
    [
      0,
      0,
      0,
      1,
      3,
      2,
      1,
      1
    ]
  ],
  "solutionEdges": [
    "v:7:4",
    "v:6:4",
    "h:6:4",
    "v:5:5",
    "h:5:4",
    "h:5:3",
    "v:5:3",
    "h:6:2",
    "v:5:2",
    "h:5:1",
    "h:5:0",
    "v:4:0",
    "h:4:0",
    "v:3:1",
    "h:3:0",
    "v:2:0",
    "h:2:0",
    "v:1:1",
    "h:1:1",
    "v:1:2",
    "v:2:2",
    "v:3:2",
    "h:4:2",
    "v:3:3",
    "v:2:3",
    "h:2:3",
    "v:2:4",
    "v:3:4",
    "h:4:4",
    "v:3:5",
    "h:3:5",
    "v:2:6",
    "h:2:5",
    "v:1:5",
    "h:1:4",
    "h:1:3",
    "v:0:3",
    "h:0:3",
    "h:0:4",
    "h:0:5",
    "h:0:6",
    "h:0:7",
    "v:0:8",
    "h:1:7",
    "v:1:7",
    "v:2:7",
    "v:3:7",
    "h:4:7",
    "v:4:8",
    "v:5:8",
    "v:6:8",
    "h:7:7",
    "h:7:6",
    "h:7:5",
    "v:7:5",
    "h:8:4"
  ],
  "startingEdges": [
    "h:5:1",
    "h:5:3",
    "h:7:5",
    "h:7:6",
    "h:7:7",
    "v:2:2",
    "v:2:7"
  ],
  "metadata": {
    "loopLength": 56,
    "complexityScore": 1,
    "difficultyScore": 0.5,
    "turnCount": 38,
    "regionalCoverage": 8,
    "startingEdgeRatio": 0.125,
    "boundingBoxWidthRatio": 1,
    "boundingBoxHeightRatio": 1,
    "rowsUsed": 9,
    "columnsUsed": 9,
    "estimatedSolveTimeSeconds": 448
  }
}
