{
  "schemaVersion": "1.0",
  "id": "loop-easy-daily-2026-10-16-easy",
  "seed": "daily-2026-10-16-easy",
  "generatorVersion": "pipeline-1.0.0",
  "width": 5,
  "height": 5,
  "difficulty": "easy",
  "clues": [
    [
      2,
      2,
      2,
      2,
      1
    ],
    [
      2,
      1,
      1,
      1,
      2
    ],
    [
      2,
      2,
      2,
      1,
      1
    ],
    [
      3,
      1,
      2,
      1,
      2
    ],
    [
      1,
      1,
      3,
      2,
      2
    ]
  ],
  "solutionEdges": [
    "h:4:4",
    "v:3:5",
    "v:2:5",
    "v:1:5",
    "h:1:4",
    "h:1:3",
    "v:0:3",
    "h:0:2",
    "h:0:1",
    "v:0:1",
    "h:1:0",
    "v:1:0",
    "v:2:0",
    "v:3:0",
    "h:4:0",
    "v:3:1",
    "v:2:1",
    "h:2:1",
    "h:2:2",
    "v:2:3",
    "v:3:3",
    "h:4:2",
    "v:4:2",
    "h:5:2",
    "h:5:3",
    "v:4:4"
  ],
  "startingEdges": [
    "h:1:3",
    "h:1:4",
    "h:2:1",
    "h:2:2",
    "v:2:1",
    "v:2:3",
    "v:3:3"
  ],
  "metadata": {
    "loopLength": 26,
    "complexityScore": 1,
    "difficultyScore": 0.125,
    "turnCount": 16,
    "regionalCoverage": 8,
    "startingEdgeRatio": 0.2692307692307692,
    "boundingBoxWidthRatio": 1,
    "boundingBoxHeightRatio": 1,
    "rowsUsed": 6,
    "columnsUsed": 6,
    "estimatedSolveTimeSeconds": 208
  }
}
