{
  "schemaVersion": "1.0",
  "id": "loop-beginner-catalog-beginner-6",
  "seed": "catalog-beginner-6",
  "generatorVersion": "pipeline-1.0.0",
  "width": 4,
  "height": 4,
  "difficulty": "beginner",
  "clues": [
    [
      3,
      2,
      2,
      0
    ],
    [
      3,
      1,
      2,
      1
    ],
    [
      3,
      0,
      1,
      1
    ],
    [
      2,
      2,
      2,
      1
    ]
  ],
  "solutionEdges": [
    "v:0:0",
    "h:0:0",
    "h:0:1",
    "v:0:2",
    "h:1:2",
    "v:1:3",
    "v:2:3",
    "v:3:3",
    "h:4:2",
    "h:4:1",
    "v:3:1",
    "h:3:0",
    "v:2:0",
    "h:2:0",
    "v:1:1",
    "h:1:0"
  ],
  "startingEdges": [
    "h:1:2",
    "v:0:2",
    "v:1:1",
    "v:1:3",
    "v:2:3",
    "v:3:1",
    "v:3:3"
  ],
  "metadata": {
    "loopLength": 16,
    "complexityScore": 1,
    "difficultyScore": 0,
    "turnCount": 12,
    "regionalCoverage": 8,
    "startingEdgeRatio": 0.4375,
    "boundingBoxWidthRatio": 1,
    "boundingBoxHeightRatio": 1,
    "rowsUsed": 5,
    "columnsUsed": 4,
    "estimatedSolveTimeSeconds": 64
  }
}
