{
  "schemaVersion": "1.0",
  "id": "loop-expert-daily-2026-09-29-expert",
  "seed": "daily-2026-09-29-expert",
  "generatorVersion": "pipeline-1.0.0",
  "width": 10,
  "height": 10,
  "difficulty": "expert",
  "clues": [
    [
      0,
      0,
      1,
      3,
      3,
      2,
      3,
      1,
      0,
      0
    ],
    [
      0,
      0,
      1,
      2,
      2,
      1,
      2,
      0,
      0,
      0
    ],
    [
      0,
      0,
      0,
      2,
      3,
      2,
      2,
      0,
      1,
      1
    ],
    [
      0,
      0,
      1,
      3,
      1,
      1,
      2,
      3,
      2,
      2
    ],
    [
      0,
      0,
      0,
      2,
      3,
      3,
      1,
      1,
      0,
      1
    ],
    [
      0,
      0,
      0,
      0,
      1,
      1,
      1,
      0,
      1,
      2
    ],
    [
      0,
      0,
      0,
      0,
      0,
      1,
      1,
      1,
      3,
      2
    ],
    [
      0,
      0,
      0,
      0,
      0,
      1,
      1,
      0,
      2,
      3
    ],
    [
      0,
      0,
      0,
      0,
      0,
      2,
      1,
      1,
      2,
      1
    ],
    [
      0,
      0,
      0,
      0,
      1,
      3,
      1,
      2,
      1,
      0
    ]
  ],
  "solutionEdges": [
    "v:0:5",
    "h:1:4",
    "v:0:4",
    "h:0:3",
    "v:0:3",
    "v:1:3",
    "h:2:3",
    "h:2:4",
    "v:2:5",
    "h:3:4",
    "h:3:3",
    "v:3:3",
    "h:4:3",
    "v:4:4",
    "h:5:4",
    "v:4:5",
    "h:4:5",
    "v:4:6",
    "v:5:6",
    "v:6:6",
    "v:7:6",
    "v:8:6",
    "h:9:5",
    "v:9:5",
    "h:10:5",
    "h:10:6",
    "h:10:7",
    "v:9:8",
    "v:8:8",
    "h:8:8",
    "h:8:9",
    "v:7:10",
    "h:7:9",
    "h:7:8",
    "v:6:8",
    "h:6:8",
    "h:6:9",
    "v:5:10",
    "v:4:10",
    "v:3:10",
    "h:3:9",
    "h:3:8",
    "v:3:8",
    "h:4:7",
    "v:3:7",
    "h:3:6",
    "v:2:6",
    "v:1:6",
    "h:1:6",
    "v:0:7",
    "h:0:6",
    "h:0:5"
  ],
  "startingEdges": [
    "h:3:8",
    "v:5:6",
    "v:6:6",
    "v:7:6"
  ],
  "metadata": {
    "loopLength": 52,
    "complexityScore": 1,
    "difficultyScore": 0.75,
    "turnCount": 34,
    "regionalCoverage": 6,
    "startingEdgeRatio": 0.07692307692307693,
    "boundingBoxWidthRatio": 0.8,
    "boundingBoxHeightRatio": 1,
    "rowsUsed": 11,
    "columnsUsed": 8,
    "estimatedSolveTimeSeconds": 416
  }
}
