{
  "schemaVersion": "1.0",
  "id": "loop-medium-daily-2026-10-13-medium",
  "seed": "daily-2026-10-13-medium",
  "generatorVersion": "pipeline-1.0.0",
  "width": 7,
  "height": 7,
  "difficulty": "medium",
  "clues": [
    [
      2,
      2,
      1,
      1,
      1,
      2,
      3
    ],
    [
      3,
      3,
      2,
      0,
      1,
      3,
      1
    ],
    [
      2,
      1,
      3,
      1,
      0,
      2,
      1
    ],
    [
      3,
      2,
      2,
      0,
      1,
      2,
      1
    ],
    [
      1,
      1,
      2,
      2,
      2,
      2,
      1
    ],
    [
      0,
      0,
      1,
      2,
      3,
      2,
      3
    ],
    [
      0,
      0,
      1,
      2,
      2,
      2,
      2
    ]
  ],
  "solutionEdges": [
    "v:2:3",
    "h:2:2",
    "v:1:2",
    "h:1:1",
    "v:1:1",
    "h:2:0",
    "v:1:0",
    "v:0:0",
    "h:0:0",
    "h:0:1",
    "h:0:2",
    "h:0:3",
    "h:0:4",
    "h:0:5",
    "h:0:6",
    "v:0:7",
    "h:1:6",
    "h:1:5",
    "v:1:5",
    "h:2:5",
    "v:2:6",
    "v:3:6",
    "h:4:5",
    "h:4:4",
    "v:4:4",
    "v:5:4",
    "h:6:4",
    "v:5:5",
    "h:5:5",
    "h:5:6",
    "v:5:7",
    "h:6:6",
    "v:6:6",
    "h:7:5",
    "h:7:4",
    "h:7:3",
    "v:6:3",
    "v:5:3",
    "v:4:3",
    "h:4:2",
    "h:4:1",
    "h:4:0",
    "v:3:0",
    "h:3:0",
    "h:3:1",
    "h:3:2"
  ],
  "startingEdges": [
    "h:1:6",
    "h:3:1",
    "h:4:1",
    "h:4:4",
    "v:2:6",
    "v:3:6",
    "v:5:3",
    "v:6:3"
  ],
  "metadata": {
    "loopLength": 46,
    "complexityScore": 1,
    "difficultyScore": 0.375,
    "turnCount": 26,
    "regionalCoverage": 9,
    "startingEdgeRatio": 0.17391304347826086,
    "boundingBoxWidthRatio": 1,
    "boundingBoxHeightRatio": 1,
    "rowsUsed": 8,
    "columnsUsed": 8,
    "estimatedSolveTimeSeconds": 368
  }
}
