{
  "schemaVersion": "1.0",
  "id": "loop-easy-catalog-easy-22",
  "seed": "catalog-easy-22",
  "generatorVersion": "pipeline-1.0.0",
  "width": 5,
  "height": 5,
  "difficulty": "easy",
  "clues": [
    [
      3,
      1,
      2,
      2,
      1
    ],
    [
      2,
      2,
      0,
      1,
      2
    ],
    [
      0,
      2,
      2,
      0,
      2
    ],
    [
      1,
      1,
      3,
      2,
      3
    ],
    [
      3,
      2,
      2,
      1,
      3
    ]
  ],
  "solutionEdges": [
    "v:2:2",
    "h:3:2",
    "v:3:3",
    "h:4:2",
    "h:4:1",
    "h:4:0",
    "v:4:0",
    "h:5:0",
    "h:5:1",
    "h:5:2",
    "h:5:3",
    "h:5:4",
    "v:4:5",
    "h:4:4",
    "v:3:4",
    "h:3:4",
    "v:2:5",
    "v:1:5",
    "h:1:4",
    "h:1:3",
    "v:0:3",
    "h:0:2",
    "h:0:1",
    "h:0:0",
    "v:0:0",
    "h:1:0",
    "v:1:1",
    "h:2:1"
  ],
  "startingEdges": [
    "h:1:3",
    "h:1:4",
    "h:2:1",
    "h:4:0",
    "h:4:1",
    "v:0:3",
    "v:1:1",
    "v:2:2"
  ],
  "metadata": {
    "loopLength": 28,
    "complexityScore": 1,
    "difficultyScore": 0.125,
    "turnCount": 18,
    "regionalCoverage": 9,
    "startingEdgeRatio": 0.2857142857142857,
    "boundingBoxWidthRatio": 1,
    "boundingBoxHeightRatio": 1,
    "rowsUsed": 6,
    "columnsUsed": 6,
    "estimatedSolveTimeSeconds": 224
  }
}
