{
  "schemaVersion": "1.0",
  "id": "loop-medium-catalog-medium-0",
  "seed": "catalog-medium-0",
  "generatorVersion": "pipeline-1.0.0",
  "width": 7,
  "height": 7,
  "difficulty": "medium",
  "clues": [
    [
      0,
      1,
      2,
      2,
      2,
      0,
      0
    ],
    [
      0,
      2,
      1,
      0,
      2,
      2,
      0
    ],
    [
      1,
      3,
      0,
      0,
      1,
      2,
      2
    ],
    [
      0,
      2,
      1,
      2,
      3,
      1,
      2
    ],
    [
      0,
      1,
      2,
      2,
      1,
      1,
      1
    ],
    [
      0,
      1,
      2,
      1,
      2,
      1,
      1
    ],
    [
      0,
      1,
      3,
      2,
      3,
      1,
      2
    ]
  ],
  "solutionEdges": [
    "v:2:6",
    "h:2:5",
    "v:1:5",
    "h:1:4",
    "v:0:4",
    "h:0:3",
    "h:0:2",
    "v:0:2",
    "v:1:2",
    "h:2:1",
    "v:2:1",
    "h:3:1",
    "v:3:2",
    "v:4:2",
    "v:5:2",
    "v:6:2",
    "h:7:2",
    "v:6:3",
    "v:5:3",
    "v:4:3",
    "h:4:3",
    "v:3:4",
    "h:3:4",
    "v:3:5",
    "v:4:5",
    "v:5:5",
    "h:6:4",
    "v:6:4",
    "h:7:4",
    "h:7:5",
    "h:7:6",
    "v:6:7",
    "v:5:7",
    "v:4:7",
    "v:3:7",
    "h:3:6"
  ],
  "startingEdges": [
    "v:0:2",
    "v:1:2",
    "v:4:2",
    "v:4:5",
    "v:5:2",
    "v:5:3"
  ],
  "metadata": {
    "loopLength": 36,
    "complexityScore": 1,
    "difficultyScore": 0.375,
    "turnCount": 22,
    "regionalCoverage": 6,
    "startingEdgeRatio": 0.16666666666666666,
    "boundingBoxWidthRatio": 1,
    "boundingBoxHeightRatio": 1,
    "rowsUsed": 8,
    "columnsUsed": 7,
    "estimatedSolveTimeSeconds": 288
  }
}
