{
  "schemaVersion": "1.0",
  "id": "loop-beginner-daily-2026-09-23-beginner",
  "seed": "daily-2026-09-23-beginner",
  "generatorVersion": "pipeline-1.0.0",
  "width": 4,
  "height": 4,
  "difficulty": "beginner",
  "clues": [
    [
      0,
      1,
      2,
      3
    ],
    [
      1,
      2,
      2,
      3
    ],
    [
      2,
      1,
      1,
      3
    ],
    [
      2,
      2,
      2,
      1
    ]
  ],
  "solutionEdges": [
    "v:2:0",
    "v:3:0",
    "h:4:0",
    "h:4:1",
    "v:3:2",
    "h:3:2",
    "h:3:3",
    "v:2:4",
    "h:2:3",
    "v:1:3",
    "h:1:3",
    "v:0:4",
    "h:0:3",
    "h:0:2",
    "v:0:2",
    "v:1:2",
    "h:2:1",
    "h:2:0"
  ],
  "startingEdges": [
    "h:2:0",
    "h:2:1",
    "h:3:2",
    "h:3:3",
    "v:0:2",
    "v:1:2",
    "v:1:3",
    "v:3:2"
  ],
  "metadata": {
    "loopLength": 18,
    "complexityScore": 1,
    "difficultyScore": 0,
    "turnCount": 12,
    "regionalCoverage": 8,
    "startingEdgeRatio": 0.4444444444444444,
    "boundingBoxWidthRatio": 1,
    "boundingBoxHeightRatio": 1,
    "rowsUsed": 5,
    "columnsUsed": 5,
    "estimatedSolveTimeSeconds": 72
  }
}
