{
  "schemaVersion": "1.0",
  "id": "loop-beginner-catalog-expanded-beginner-0",
  "seed": "catalog-expanded-beginner-0",
  "generatorVersion": "pipeline-1.0.0",
  "width": 4,
  "height": 4,
  "difficulty": "beginner",
  "clues": [
    [
      2,
      2,
      2,
      3
    ],
    [
      2,
      2,
      1,
      1
    ],
    [
      2,
      2,
      0,
      0
    ],
    [
      2,
      3,
      1,
      0
    ]
  ],
  "solutionEdges": [
    "h:0:1",
    "h:0:2",
    "h:0:3",
    "v:0:4",
    "h:1:3",
    "h:1:2",
    "h:1:1",
    "v:1:1",
    "v:2:1",
    "h:3:1",
    "v:3:2",
    "h:4:1",
    "h:4:0",
    "v:3:0",
    "v:2:0",
    "v:1:0",
    "v:0:0",
    "h:0:0"
  ],
  "startingEdges": [
    "h:0:1",
    "h:1:1",
    "h:1:2",
    "h:1:3",
    "h:3:1",
    "v:1:1",
    "v:2:1",
    "v:3:2"
  ],
  "metadata": {
    "loopLength": 18,
    "complexityScore": 0.8888888888888888,
    "difficultyScore": 0,
    "turnCount": 8,
    "regionalCoverage": 8,
    "startingEdgeRatio": 0.4444444444444444,
    "boundingBoxWidthRatio": 1,
    "boundingBoxHeightRatio": 1,
    "rowsUsed": 5,
    "columnsUsed": 5,
    "estimatedSolveTimeSeconds": 72
  }
}
