{
  "schemaVersion": "1.0",
  "id": "loop-medium-catalog-expanded-medium-1",
  "seed": "catalog-expanded-medium-1",
  "generatorVersion": "pipeline-1.0.0",
  "width": 7,
  "height": 7,
  "difficulty": "medium",
  "clues": [
    [
      3,
      1,
      1,
      1,
      1,
      2,
      1
    ],
    [
      2,
      1,
      0,
      1,
      1,
      1,
      1
    ],
    [
      2,
      1,
      2,
      2,
      3,
      2,
      1
    ],
    [
      3,
      1,
      3,
      1,
      3,
      1,
      2
    ],
    [
      3,
      1,
      3,
      1,
      2,
      2,
      3
    ],
    [
      3,
      1,
      3,
      1,
      0,
      1,
      1
    ],
    [
      2,
      2,
      2,
      3,
      1,
      0,
      0
    ]
  ],
  "solutionEdges": [
    "v:0:6",
    "v:1:6",
    "v:2:6",
    "v:3:6",
    "h:4:6",
    "v:4:7",
    "h:5:6",
    "h:5:5",
    "v:4:5",
    "h:4:4",
    "v:3:4",
    "h:3:4",
    "v:2:5",
    "h:2:4",
    "h:2:3",
    "v:2:3",
    "h:3:2",
    "v:3:2",
    "h:4:2",
    "v:4:3",
    "h:5:2",
    "v:5:2",
    "h:6:2",
    "h:6:3",
    "v:6:4",
    "h:7:3",
    "h:7:2",
    "h:7:1",
    "v:6:1",
    "h:6:0",
    "v:5:0",
    "h:5:0",
    "v:4:1",
    "h:4:0",
    "v:3:0",
    "h:3:0",
    "v:2:1",
    "v:1:1",
    "h:1:0",
    "v:0:0",
    "h:0:0",
    "h:0:1",
    "h:0:2",
    "h:0:3",
    "h:0:4",
    "h:0:5"
  ],
  "startingEdges": [
    "h:2:3",
    "h:5:5",
    "v:0:6",
    "v:1:1",
    "v:1:6",
    "v:2:1",
    "v:2:6",
    "v:3:6"
  ],
  "metadata": {
    "loopLength": 46,
    "complexityScore": 1,
    "difficultyScore": 0.375,
    "turnCount": 32,
    "regionalCoverage": 9,
    "startingEdgeRatio": 0.17391304347826086,
    "boundingBoxWidthRatio": 1,
    "boundingBoxHeightRatio": 1,
    "rowsUsed": 8,
    "columnsUsed": 8,
    "estimatedSolveTimeSeconds": 368
  }
}
