{
  "schemaVersion": "1.0",
  "id": "loop-hard-catalog-hard-1",
  "seed": "catalog-hard-1",
  "generatorVersion": "pipeline-1.0.0",
  "width": 8,
  "height": 8,
  "difficulty": "hard",
  "clues": [
    [
      2,
      2,
      1,
      2,
      2,
      1,
      2,
      2
    ],
    [
      2,
      0,
      1,
      2,
      3,
      1,
      0,
      2
    ],
    [
      2,
      1,
      2,
      2,
      2,
      0,
      0,
      2
    ],
    [
      2,
      2,
      2,
      2,
      1,
      0,
      1,
      3
    ],
    [
      3,
      2,
      2,
      1,
      0,
      0,
      0,
      3
    ],
    [
      1,
      1,
      2,
      1,
      0,
      0,
      1,
      2
    ],
    [
      0,
      0,
      1,
      1,
      0,
      0,
      1,
      1
    ],
    [
      0,
      0,
      1,
      2,
      1,
      1,
      2,
      1
    ]
  ],
  "solutionEdges": [
    "h:0:3",
    "h:0:2",
    "h:0:1",
    "v:0:1",
    "h:1:0",
    "v:1:0",
    "v:2:0",
    "h:3:0",
    "h:3:1",
    "h:3:2",
    "v:2:3",
    "v:1:3",
    "h:1:3",
    "h:1:4",
    "v:1:5",
    "h:2:4",
    "v:2:4",
    "v:3:4",
    "h:4:3",
    "h:4:2",
    "h:4:1",
    "h:4:0",
    "v:4:0",
    "h:5:0",
    "h:5:1",
    "h:5:2",
    "v:5:3",
    "v:6:3",
    "v:7:3",
    "h:8:3",
    "h:8:4",
    "h:8:5",
    "h:8:6",
    "v:7:7",
    "v:6:7",
    "v:5:7",
    "h:5:7",
    "v:4:8",
    "h:4:7",
    "v:3:7",
    "h:3:7",
    "v:2:8",
    "v:1:8",
    "h:1:7",
    "v:0:7",
    "h:0:6",
    "h:0:5",
    "h:0:4"
  ],
  "startingEdges": [
    "h:3:1",
    "h:4:3",
    "h:5:1",
    "v:1:3",
    "v:6:3",
    "v:6:7"
  ],
  "metadata": {
    "loopLength": 48,
    "complexityScore": 1,
    "difficultyScore": 0.5,
    "turnCount": 24,
    "regionalCoverage": 8,
    "startingEdgeRatio": 0.125,
    "boundingBoxWidthRatio": 1,
    "boundingBoxHeightRatio": 1,
    "rowsUsed": 9,
    "columnsUsed": 9,
    "estimatedSolveTimeSeconds": 384
  }
}
